{
  "version": 1,
  "stages": [
    "phase-0",
    "phase-1",
    "phase-2",
    "phase-3",
    "phase-4",
    "phase-5",
    "phase-6",
    "phase-7",
    "phase-8"
  ],
  "claims_new_ecosystem_support": false,
  "generic_fixtures_are_contract_only": true,
  "capabilities": [
    {
      "stage": "phase-0",
      "source": ["skills/flutter-app-pipeline/SKILL.md#relationship-to-two-model-sdd-pipeline"],
      "current_owner": "Flutter skill entry layered over the shared harness",
      "disposition": "adaptation-required",
      "target_owner": "Shared planning entry with a Flutter specialization",
      "plan_task": "R5.7",
      "evidence": ["README.md", "skills/using-superpowers/SKILL.md#pipeline-integration"],
      "callers": ["README.md", "skills/using-superpowers/SKILL.md"]
    },
    {
      "stage": "phase-1",
      "source": ["skills/flutter-app-pipeline/SKILL.md#phase-1-requirements"],
      "current_owner": "Flutter planning skill",
      "disposition": "adaptation-required",
      "target_owner": "Shared applicable requirement profiles with ecosystem overlays",
      "plan_task": "R5.4",
      "evidence": ["skills/brainstorming/SKILL.md", "roadmap.md#d13--baseline-requirements-are-profiles-not-unconditional-features"],
      "callers": ["skills/brainstorming/SKILL.md", "skills/writing-plans/SKILL.md"]
    },
    {
      "stage": "phase-1",
      "source": ["skills/flutter-app-pipeline/SKILL.md#interface-design"],
      "current_owner": "Apple-design Flutter UI specialization",
      "disposition": "flutter-specific",
      "target_owner": "Flutter UI adapter; generic profile resolver selects UI applicability only when declared",
      "plan_task": "R5.4",
      "evidence": ["skills/flutter-app-pipeline/SKILL.md", "skills/apple-design/SKILL.md"],
      "callers": ["skills/flutter-app-pipeline/SKILL.md", "skills/apple-design/SKILL.md"]
    },
    {
      "stage": "phase-2",
      "source": ["skills/flutter-app-pipeline/SKILL.md#phase-2-research--planning"],
      "current_owner": "Flutter research and template selection flow",
      "disposition": "adaptation-required",
      "target_owner": "Shared research/adoption orchestration with provider and ecosystem adapters",
      "plan_task": "R5.6",
      "evidence": ["roadmap.md#d11--generic-capabilities-ecosystem-adapters", "docs/superpowers/specs/2026-09-25-confirmed-pipeline-decisions.md#decisions"],
      "callers": ["skills/flutter-app-pipeline/SKILL.md", "skills/writing-plans/SKILL.md"]
    },
    {
      "stage": "phase-3",
      "source": ["skills/flutter-app-pipeline/SKILL.md#phase-3-tdd-implementation-two-model-loop"],
      "current_owner": "Shared task engine with Flutter command and package adapters",
      "disposition": "shared",
      "target_owner": "Accepted shared task/review/gate contracts; R5 adds dependency-policy adapter coordination",
      "plan_task": "R4.4",
      "evidence": ["skills/two-model-sdd-pipeline/SKILL.md", "skills/flutter-app-pipeline/scripts/red-gate", "skills/flutter-app-pipeline/scripts/green-gate"],
      "callers": ["skills/flutter-app-pipeline/SKILL.md", "skills/two-model-sdd-pipeline/SKILL.md"]
    },
    {
      "stage": "phase-4",
      "source": ["skills/flutter-app-pipeline/SKILL.md#phase-4-project-wide-review"],
      "current_owner": "Shared closing review with Flutter UI review criteria",
      "disposition": "adaptation-required",
      "target_owner": "Shared closing contract plus Flutter-specific UI acceptance adapter",
      "plan_task": "R3.4",
      "evidence": ["skills/two-model-sdd-pipeline/SKILL.md", "skills/flutter-app-pipeline/SKILL.md"],
      "callers": ["skills/two-model-sdd-pipeline/SKILL.md", "skills/flutter-app-pipeline/SKILL.md"]
    },
    {
      "stage": "phase-5",
      "source": ["skills/flutter-app-pipeline/SKILL.md#deterministic-scripts-no-ai-involvement"],
      "current_owner": "Flutter deterministic command adapters",
      "disposition": "adaptation-required",
      "target_owner": "Shared lifecycle contracts with stable Flutter CLI compatibility wrappers",
      "plan_task": "R5.7",
      "evidence": ["skills/flutter-app-pipeline/SKILL.md", "skills/two-model-sdd-pipeline/SKILL.md"],
      "callers": ["skills/flutter-app-pipeline/SKILL.md", "README.md"]
    },
    {
      "stage": "phase-6",
      "source": ["skills/flutter-app-pipeline/SKILL.md#data-sources-for-score-computation"],
      "current_owner": "Flutter package/template provider scoring",
      "disposition": "flutter-specific",
      "target_owner": "Flutter provider/scoring adapters behind shared research evidence contracts",
      "plan_task": "R5.6",
      "evidence": ["skills/flutter-app-pipeline/scripts/pkg_score.py", "skills/flutter-app-pipeline/scripts/template_score.py"],
      "callers": ["skills/flutter-app-pipeline/SKILL.md", "skills/flutter-app-pipeline/scripts/pkg-score", "skills/flutter-app-pipeline/scripts/template-score"]
    },
    {
      "stage": "phase-7",
      "source": ["skills/flutter-app-pipeline/SKILL.md#github-authentication-one-time-setup"],
      "current_owner": "Flutter GitHub API authentication guidance",
      "disposition": "adaptation-required",
      "target_owner": "Shared secret-safe credential policy with provider-specific token adapters",
      "plan_task": "R5.6",
      "evidence": ["skills/flutter-app-pipeline/SKILL.md", "roadmap.md#d12--skill-discovery-per-task"],
      "callers": ["skills/flutter-app-pipeline/SKILL.md", "skills/two-model-sdd-pipeline/SKILL.md"]
    },
    {
      "stage": "phase-8",
      "source": ["skills/flutter-app-pipeline/SKILL.md#summary-of-flow"],
      "current_owner": "Flutter workflow summary over shared and ecosystem-specific stages",
      "disposition": "adaptation-required",
      "target_owner": "Shared planning/adoption stages with Flutter overlay and preserved CLI entrypoints",
      "plan_task": "R5.7",
      "evidence": ["skills/flutter-app-pipeline/SKILL.md", "skills/writing-plans/SKILL.md"],
      "callers": ["skills/flutter-app-pipeline/SKILL.md", "skills/writing-plans/SKILL.md"]
    },
    {
      "stage": "phase-2",
      "source": ["skills/flutter-app-pipeline/scripts/_template_search_collect.py"],
      "current_owner": "Flutter template search collector",
      "disposition": "adaptation-required",
      "target_owner": "Shared solution research contract plus GitHub search adapter",
      "plan_task": "R5.6",
      "evidence": ["skills/flutter-app-pipeline/SKILL.md#solution-research", "skills/flutter-app-pipeline/tests/test_template_search.py"],
      "callers": ["skills/flutter-app-pipeline/scripts/template-search", "skills/flutter-app-pipeline/SKILL.md"]
    },
    {
      "stage": "phase-3",
      "source": ["skills/flutter-app-pipeline/scripts/green-gate"],
      "current_owner": "Flutter gate wrapper over accepted shared gate and review contracts",
      "disposition": "shared",
      "target_owner": "Shared gate contract; keep the Flutter command/CLI adapter",
      "plan_task": "R4.4",
      "evidence": ["skills/flutter-app-pipeline/SKILL.md#phase-3-tdd-implementation-two-model-loop", "skills/flutter-app-pipeline/tests/test_gates.py"],
      "callers": ["skills/flutter-app-pipeline/SKILL.md", "skills/two-model-sdd-pipeline/scripts/integrate"]
    },
    {
      "stage": "phase-2",
      "source": ["skills/flutter-app-pipeline/scripts/pkg_score.py"],
      "current_owner": "Flutter pub.dev/GitHub package quality scorer",
      "disposition": "flutter-specific",
      "target_owner": "Flutter scoring adapter implementing shared research evidence contracts",
      "plan_task": "R5.6",
      "evidence": ["skills/flutter-app-pipeline/SKILL.md#quality-score-0-100-per-candidate-package-pkg-score", "skills/flutter-app-pipeline/tests/test_score.py"],
      "callers": ["skills/flutter-app-pipeline/scripts/pkg-score", "skills/flutter-app-pipeline/SKILL.md"]
    },
    {
      "stage": "phase-2",
      "source": ["skills/flutter-app-pipeline/scripts/pkg-score"],
      "current_owner": "Flutter package scoring CLI",
      "disposition": "flutter-specific",
      "target_owner": "Preserve Flutter CLI over the Flutter scorer adapter",
      "plan_task": "R5.6",
      "evidence": ["skills/flutter-app-pipeline/SKILL.md#solution-research", "skills/flutter-app-pipeline/tests/test_score.py"],
      "callers": ["skills/flutter-app-pipeline/SKILL.md", "README.md"]
    },
    {
      "stage": "phase-3",
      "source": ["skills/flutter-app-pipeline/scripts/pub-sync"],
      "current_owner": "Flutter pub dependency resolver and lockfile writer",
      "disposition": "adaptation-required",
      "target_owner": "Shared dependency policy/ownership checks plus a Flutter pub execution adapter",
      "plan_task": "R5.6",
      "evidence": ["skills/flutter-app-pipeline/SKILL.md#task-documentation", "skills/flutter-app-pipeline/SKILL.md#tdd-implementation"],
      "callers": ["skills/flutter-app-pipeline/SKILL.md", "skills/flutter-app-pipeline/tests/test_gates.py"]
    },
    {
      "stage": "phase-2",
      "source": ["skills/flutter-app-pipeline/scripts/recall_suitability.py"],
      "current_owner": "Optional Jev suitability classifier after deterministic Flutter template recall",
      "disposition": "adaptation-required",
      "target_owner": "Shared evidence-gated suitability/adoption policy plus optional advisory adapter",
      "plan_task": "R5.3",
      "evidence": ["skills/flutter-app-pipeline/SKILL.md#site-2-template-recall", "skills/flutter-app-pipeline/tests/test_jev_recall_suitability.py"],
      "callers": ["skills/flutter-app-pipeline/scripts/recall-suitability", "skills/flutter-app-pipeline/SKILL.md"]
    },
    {
      "stage": "phase-2",
      "source": ["skills/flutter-app-pipeline/scripts/recall-suitability"],
      "current_owner": "Optional suitability CLI adapter",
      "disposition": "adaptation-required",
      "target_owner": "Preserve Flutter CLI over the shared evidence-gated suitability contract",